{
  "$schema": "http://json-schema.org/draft-07/schema#",
  "$id": "https://atmos.dev/schemas/project-wiki/catalog.json",
  "title": "Project Wiki Catalog Schema",
  "description": "Schema for validating the _catalog.json file in ATMOS Project Wiki. Supports two-part structure (Getting Started + Deep Dive) with reading time and difficulty level metadata.",
  "type": "object",
  "required": ["version", "generated_at", "project", "catalog", "commit_hash"],
  "properties": {
    "version": {
      "type": "string",
      "description": "The version of the catalog format",
      "pattern": "^\\d+\\.\\d+$",
      "examples": ["2.0"]
    },
    "generated_at": {
      "type": "string",
      "description": "ISO 8601 timestamp of when the catalog was generated",
      "format": "date-time",
      "examples": ["2026-02-10T12:00:00Z"]
    },
    "commit_hash": {
      "type": "string",
      "description": "Git HEAD commit hash when the wiki was generated (required for incremental updates)",
      "pattern": "^[0-9a-f]{7,40}$",
      "examples": ["abc1234", "a1b2c3d4e5f6789012345678901234567890abcd"]
    },
    "project": {
      "type": "object",
      "description": "Metadata about the project",
      "required": ["name", "description"],
      "properties": {
        "name": {
          "type": "string",
          "description": "The name of the project",
          "minLength": 1,
          "examples": ["ATMOS"]
        },
        "description": {
          "type": "string",
          "description": "A brief description of the project",
          "minLength": 1,
          "examples": ["Visual Terminal Workspace"]
        },
        "repository": {
          "type": "string",
          "description": "The URL of the project repository",
          "format": "uri",
          "examples": ["https://github.com/AruNi-01/atmos"]
        }
      },
      "additionalProperties": false
    },
    "catalog": {
      "type": "array",
      "description": "The hierarchical catalog structure. Top-level sections: getting-started, deep-dive, and optionally specify-wiki.",
      "minItems": 1,
      "items": {
        "$ref": "#/definitions/catalogItem"
      }
    }
  },
  "additionalProperties": false,
  "definitions": {
    "catalogItem": {
      "type": "object",
      "description": "A single item in the catalog tree",
      "required": ["id", "title", "path", "order", "file", "children"],
      "properties": {
        "id": {
          "type": "string",
          "description": "Unique identifier for this catalog item, using dot notation for hierarchy",
          "pattern": "^[a-z0-9]+(-[a-z0-9]+)*(\\.[a-z0-9]+(-[a-z0-9]+)*)*$",
          "examples": [
            "getting-started",
            "getting-started.quick-start",
            "deep-dive.infra.websocket"
          ]
        },
        "title": {
          "type": "string",
          "description": "Display title for this catalog item",
          "minLength": 1,
          "examples": ["Getting Started", "Quick Start", "WebSocket Service Deep Dive"]
        },
        "path": {
          "type": "string",
          "description": "File path relative to .atmos/wiki/ directory",
          "pattern": "^[a-z0-9]+(-[a-z0-9]+)*(/[a-z0-9]+(-[a-z0-9]+)*)*$",
          "examples": [
            "getting-started",
            "getting-started/quick-start",
            "deep-dive/infra/websocket"
          ]
        },
        "order": {
          "type": "integer",
          "description": "Sort order for this item among its siblings",
          "minimum": 0,
          "examples": [0, 1, 2]
        },
        "file": {
          "type": "string",
          "description": "Path to the Markdown file for this item, relative to .atmos/wiki/",
          "pattern": "^[a-z0-9]+(-[a-z0-9]+)*(/[a-z0-9]+(-[a-z0-9]+)*)*\\.(md|markdown)$",
          "examples": ["getting-started/index.md", "deep-dive/infra/websocket.md"]
        },
        "section": {
          "type": "string",
          "description": "Which major section this article belongs to",
          "enum": ["getting-started", "deep-dive", "specify-wiki"],
          "examples": ["getting-started", "deep-dive", "specify-wiki"]
        },
        "level": {
          "type": "string",
          "description": "Difficulty level of this article",
          "enum": ["beginner", "intermediate", "advanced"],
          "examples": ["beginner", "intermediate", "advanced"]
        },
        "reading_time": {
          "type": "integer",
          "description": "Estimated reading time in minutes",
          "minimum": 1,
          "maximum": 30,
          "examples": [5, 10, 15]
        },
        "children": {
          "type": "array",
          "description": "Child catalog items",
          "items": {
            "$ref": "#/definitions/catalogItem"
          },
          "default": []
        }
      },
      "additionalProperties": false
    }
  }
}
