{
  "version": "2.0",
  "generated_at": "REPLACE_ISO8601",
  "commit_hash": "REPLACE_GIT_REV_PARSE_HEAD",
  "project": {
    "name": "REPLACE_PROJECT_NAME",
    "description": "REPLACE_PROJECT_DESCRIPTION",
    "repository": "REPLACE_REPO_URL_OR_OMIT"
  },
  "catalog": [
    {
      "id": "getting-started",
      "title": "Getting Started",
      "path": "getting-started",
      "order": 0,
      "file": "getting-started/index.md",
      "section": "getting-started",
      "level": "beginner",
      "reading_time": 5,
      "children": []
    },
    {
      "id": "deep-dive",
      "title": "Deep Dive",
      "path": "deep-dive",
      "order": 1,
      "file": "deep-dive/index.md",
      "section": "deep-dive",
      "level": "intermediate",
      "reading_time": 5,
      "children": []
    }
  ]
}
